Action,Score,The Pick,Odds
VALUE,75,NPB Orix Buffaloes o3.5 runs (vs Fukuoka SoftBank Hawks),-105
VALUE,65,Tennis Emilio Nava ML (vs Thiago Seyboth Wild),-185
SKIP,60,Football Aston Villa to win (vs Freiburg),-133
SKIP,60,MLB Braves -1.5 (vs Marlins),-106
SKIP,60,eSports T1 -1.5 Map Handicap (vs DRX) + KT ML (vs KRX),-135
SKIP,60,Football Grindavik/Njardvik W vs Stjarnan W o2.5 TG,-143
SKIP,50,Tennis Gonzalo Bueno ML (vs Vitaliy Sachko),-120
SKIP,50,MLB Aaron Judge o0.5 RBI (Blue Jays vs Yankees),145
SKIP,20,NBA Stephon Castle u7.5 FG attempted (Spurs vs Thunder),-105
