Action,Score,The Pick,Odds
MAX BET,90,Football Motherwell vs Celtic BTTS + Hearts vs Falkirk o2.5 TG,152
MAX BET,90,NBA Ausar Thomson o6.5 R + Cade Cunningham 6+ A (Pistons vs Cavaliers),-127
VALUE,75,Football Kyoto Sanga o1.0 goals (vs Vissel Kobe),160
VALUE,75,eSports Techno u8.5 headshots Map 1 (Aurora vs MongolZ),-147
SKIP,60,WNBA Caitlin Clark 20+ points (Fever vs Sparks),-120
SKIP,60,Football Barcelona u2.5 goals + Alaves o2.5 shots on target,-133
SKIP,60,Football Manchester City -1.5 (vs Crystal Palace),-170
SKIP,50,NBA Evan Mobley 4+ assists (Pistons vs Cavaliers),128
SKIP,50,Football Anyang vs Gimcheon Sangmu BTTS,-125
