Action,Score,The Pick,Odds
VALUE,75,Football Malut United vs Persebaya: Over 2.5 Total Goals,-125
VALUE,75,Football STUTTGART VS FREIBURG O 3.5 g,160
SKIP,60,AFL SYDNEY TT OVER 105.5 POINTS (Western Bulldogs vs Sydney),-115
SKIP,60,NBA CJ McCollum over 6.5 FGs made (NY Knicks vs ATL Hawks),-152
SKIP,60,NHL Logan Stankoven over 0.5 points (Carolina Hurricanes vs Ottawa Senators),104
SKIP,60,MLB New York Yankees -1.5 (vs Boston Red Sox),110
SKIP,20,MLB NRFI & Tigers first five innings ML (Tigers vs Brewers),107
SKIP,20,Golf Griffin + Novak to finish Top 10 Zurich Classic (resolves Sunday),135
