Action,Score,The Pick,Odds
VALUE,65,Football Bournemouth o0.5 TG (vs Arsenal),-132
SKIP,60,AFL Hawthorn vs Western Bulldogs u182.5 points,-111
SKIP,60,Football Wolfsburg vs Eintracht Frankfurt BTTS + o2.5 TG,-125
SKIP,60,UFC Mateusz Gamrot ML (vs Esteban Ribovics),-188
SKIP,50,Football Sparta Rotterdam vs PSV BTTS + o2.5 TG + Viking vs Bodø/Glimt o2.5 TG,2
SKIP,50,MLB Francisco Lindor o0.5 RBIs (Athletics vs Mets),215
SKIP,50,Football Wigan vs Mansfield Town o2.5 TG,100
SKIP,50,Football Song Lam Nghe An vs Da Nang BTTS,-120
SKIP,50,Rugby Sua Fa'alogo ATS (Storm vs Warriors),-143
